,국가,날짜,구분,분야,제목,본문1,본문2,본문3,제목_현지공용어,본문1_현지공용어,본문2_현지공용어,본문3_현지공용어,출처,링크
157,이라크,2022-02-07,국제기구,성평등,"UNFPA, IOM, UN 여성, 여성 폭력 생존자를 위한 법적 체계 강화 지원",여성 권한 부여 부서는 아랍 여성 단체와 협력하여 2월 3-4일 이틀간 회의를 조직하여 무력 충돌과 전쟁으로 피해를 입은 아랍 국가의 폭력 생존 여성을 위한 법적 틀에 대해 논의했습니다.,"쿠르디스탄 지역을 포함한 예멘, 레바논, 시리아, 수단, 팔레스타인, 이라크 대표단이 UNFPA, UNWomen 및 IOM의 지원을 받아 회의에 참석했습니다. 아랍 국가의 초청 패널리스트는 여성, 평화 및 안보에 관한 유엔 결의 1325호에 대한 각국의 진전을 발표했습니다.","회의는 여성 대표성을 강화하고, 1325 결의안을 이행하기 위한 플랫폼을 구축하고, 생존자 중심 접근을 보장하는 여성에 대한 폭력 퇴치를 위한 법안을 개선하기 위한 권고안을 도출했습니다.","UNFPA, IOM, UN Women Support Strengthening Legal Frameworks for Female Survivors of Violence","The Women Empowerment Department, in collaboration with the Arab Women Organisation, organised a two-day conference on 3-4 February to discuss the legal frameworks for female survivors of violence in Arab countries affected by armed conflicts and war.","Delegates from Yemen, Lebanon, Syria, Sudan, Palestine and Iraq, including the Kurdistan Region, attended the conference, supported by UNFPA, UNWomen and IOM. Guest panellists from the Arab countries presented their countries’ progress regarding the UN resolution 1325 on women, peace and security.","The meeting resulted in recommendations for strengthening women representation, building platforms for implementing the 1325 Resolution and improving legislation to combat violence against women ensuring survivors centred approach.",UNFPA,https://iraq.unfpa.org/en/news/unfpa-iom-un-women-support-strengthening-legal-frameworks-female-survivors-violence
158,캄보디아,2022-02-08,공여국,거버넌스평화,"일본, ECCC에 22만 달러 지원","주캄 일본대사관은 2.7(월) 보도자료를 통해, 일본 정부가 유엔을 통해 크메르루즈특별재판소(ECCC)에 22만 달러를 지원했다고 발표함. 일본 정부는 22만 달러를 추가로 지원하여 지금까지 총 8,870만 달러의 역사적 기여했다고 밝힘.일본 대사관이 발표한 언론 성명에 따르면 일본은 재판소의 사법 절차를 지원하기 위해 금액을 기부했다고 밝히며,넷 페아뜨라 ECCC 대변인은 “일본 정부는 ECCC 최대 지원국이며, 현재까지의 누적 지원금은 총 88.7백만 달러로 전체 지원금의 약 27%를 차지한다고 말함.","일본 정부는 재판소에 중요한 3가지 점을 시사했는데, 주로 크메르루즈 재판은 전쟁 중에 자행된 만행의 재발을 막기 위한 캄보디아 평화 프로세스의 완성 단계이며, 재판소는 크메르루즈 대량학살 정권의 희생자들에게 정의를 구현하고 국가적 화해에 기여할 것이라고 말함.",,"Japan provides $220,000 in financial assistance to ECCC","The Government of Japan on February 4 disbursed an amount of $220,000 as its contribution to the United Nations component of the Extraordinary Chambers in the Courts of Cambodia (ECCC)’s budget.","“The Government of Japan attaches importance to the Khmer Rouge Tribunal from three points of view. Firstly, the Khmer Rouge trials are the completing stage of the Cambodian peace process in order to prevent the recurrence of atrocities committed during the Khmer Rouge period. Secondly, the Tribunal will help deliver justice to the victims of the Khmer Rouge and, therefore, contribute to national reconciliation. Thirdly, the Tribunal will contribute to strengthening the rule of law in Cambodia as well as in the international community,” it underlined.",,"대사관, Khmer Times",https://www.khmertimeskh.com/501020562/japan-provides-220000-in-financial-assistance-to-eccc/
159,탄자니아,2022-02-08,수원국,인권,"도도마시, 여성과 청소년에 약 8억실링 규모 대출 제공","도도마 시의회는 청년, 여성, 장애인에게 대출로 발행되어야 하는 지자체 수입 10%의 일부로 창업가 단체에 약 8억실링(한화 4억원 상당) 이상의 대출을 제공함.","지원된 대출금은 정부의 목표인 개인 및 실물 경제 성장 촉진에 부응하기 위해 개인, 지역 사회 및 국가 전체의 경제 발전을 가져오는 데 사용되어야 함.","Mafuru 의장은 지난 주말 46개 여성단체가 3억9천5백만실링, 23개 청년단체가 3억6천4백만실링, 19개 장애인단체가 5천8백만실링을 대출받아 총 78개 그룹에 8억11천7백만실링의 대출금이 제공됨을 밝힘.","Dodoma City Grants 800m/ - Loans to Women, Youth","DODOMA City Council has granted over 800m/- in loans to entrepreneurial groups, as part of 10 percent of local revenue that should be issued as a loan to youth, women, and people with special needs.","These loans should be used to bring economic development to the individual, the community around those granted, and the nation as a whole, by fulfilling the government's goal of promoting personal and material economy","Giving a break down, Director Mafuru said that of the loans disbursed over the last weekend, 46 women's groups received 395,000,000/-, 23 youth groups received 364,000,000/- and 19 groups of people with special needs received 58,400,000/- making a total of 78 groups earning a total of 817,400,000/-",All Africa,https://allafrica.com/stories/202202080140.html
160,베트남,2022-02-08,수원국,교육,"문맹 퇴치 및 교육 보편화, 큰 진전 달성","베트남이 학습사회로의 발전을 추구함에 따라, 문맹 퇴치 및 교육 보편화에 큰 진전을 거둔 것으로 확인됨. 모든 성시는 5세 아동 대상 유치원 교육 보편화라는 목표를 달성했으며, 초등 교육 보편화는 2단계 기준, 중등교육 보편화는 1단계 기준을 충족함. ","교육 네트워크는 전국적으로 확대됨. 교육기관은 온라인 수업, TV활용 수업을 장려하고 있으며 점진적인 대규모 온라인 공개 강좌를 개발하고 있음. 베트남은 다음 단계로써 2021년에서 2030년까지 모든 국민이 동등한 기회로 양질의 평생교육을 받을 수 있도록 개방적이고 유연하며, 연결된 교육 시스템을 개발하고 있음.",Nguyen Kim Son 베트남 교육훈련부(Ministry of Education and Training) 장관은 학습사회 발전에 필요한 모든 부서와 기관의 역할을 명확히 규정할 필요가 있다고 강조함.,"Great progress made in illiteracy eradication, education universalisation","Great progress has been observed in illiteracy eradication and education universalisation in Viet Nam, as the country continues building a learning society. All the provinces and cities have fulfilled the target of universalising preschool education for five-year-old children, met the standard of primary education universalisation at level 2 and secondary education universalisation at level 1. ","Network of educational establishments were expanded nationwide. Educational institutions have promoted online learning and teaching, teaching on television, and have gradually developed mass open online courses. In the next phase from 2021-2030, Vit Nam develops an open, flexible and connected education system and make sure all people will have an equal opportunity to access high-quality life-long education.",Minister of Education and Training Nguyen Kim Son has underlined the need to clearly define the role of elements and parties involved in learning society development in the coming time.,Vietnam News,https://vietnamnews.vn/society/1142909/great-progress-made-in-illiteracy-eradication-education-universalisation.html
161,몽골,2022-02-08,수원국,기후행동,UNDP 지원사업 일환으로 온라인 세미나 추진,"ㅇ 유럽연맹 지원으로 추진 중인 UNDP ‘몽골 SDGs과 연계된 예산기획을 통한 근로 환경 개선 지원’사업 관련 2.7.(월) 몽골 감사원과 “국가 정책 평가, 정부 및 국가예산 프로그램 집행에 대한 감사 실시”를 주제로 온라인 세미나를 개최함.","ㅇ 동 세미나에는 약 160여명의 몽골 감사원 및 지방 감사국 관계자들이 참석하여 △국가정책 △정부정책 및 예산 프로그램 집행 관련 감사 실시 방법에 대한 지식을 공유하고, 향후 감사 집행 강화 방안에 대해 논의함.",,,,,,mn.undp.org,https://www.mn.undp.org/content/mongolia/en/home/presscenter/speeches/_gender-mainstreaming-framework-for-mongolian-financial-sector--.html
162,모로코,2022-02-08,공여국,과학기술혁신,"ONEE, FRIDSI와 협력하여 송전선로 검사 자동화","과학 및 공학 연구, 개발 및 혁신 재단(FRDISI)과 국립 전기 및 식수국(ONEE)은 드론과 이미지 처리 기술을 통한 송전선로 자동검사를 위한 플랫폼 이행 협정을 맺음. ","이 파트너십의 목표는 공중 궤도를 이용한 송전선로 검사를 위한 지능형 자동 플랫폼을 배치하는 데 있음. 프로젝트는 직원 안전 향상, 라인 가동 중단 시간 감소, 진단 프로세스 자동화 및 효율성 향상을 포함하여 운영 성과 향상을 위한 전략의 일부임."," 두 기관은 국가규모의 프로젝트의 혁신적 특성을 고려하여, 학술 논문 발표 및 모로코 산업 및 상업 재산권 사무소에 특허 출원할 계획임.","ONEE, FRIDSI Partner to Automate Inspection of Power Lines","The Foundation for Research, Development and Innovation in Science and Engineering (FRDISI) and the National Office of Electricity and Drinking Water (ONEE) signed a specific agreement for the design and implementation of a platform for automated inspection of power transmission lines, through the use of drones and image processing.   ","This partnership's ambitious actions aim to deploy an intelligent automated platform for the inspection of transmission lines using aerial vectors. The project is part of a strategy to considerably enhance operating performance, including enhanced staff safety, reduced line downtime, automation of diagnostic processes, and increased efficiency.","Both parties intend to publish scholarly papers and file a patent with the Moroccan Office of Industrial and Commercial Property, given the project's innovative nature on a national scale.",Morocco World News,https://www.moroccoworldnews.com/2022/02/347012/onee-fridsi-partner-to-automate-inspection-of-power-lines
163,모잠비크,2022-02-08,공여국,기후행동,"EU, 모잠비크에 대한 추가 지원 약속",EU는 자연재해로 인한 심각한 피해를 완화하기 위해 모잠비크를 지원하겠다는 약속을 재차 확인함.,"EU는 인도적 지원, 투자, 기반 시설 및 평화 통합과 같은 분야에 중점을 둔 모잠비크의 주요한 파트너 중 하나임.",모잠비크는 다양한 사회 및 경제 개발 프로젝트 수행을 위해 연간 약 7억 유로로 추산되는 EU의 재정 지원을 두 번째로 가장 많이 받는 아프리카 국가임.,Mozambique: EU Pledges Further Support to Mozambique,The European Union (EU) reaffirmed its commitment to supporting Mozambique to mitigate the severe impacts caused by natural disasters.,"The European Union is among Mozambique's main cooperation partners with emphasis on fields such as humanitarian assistance, investment, infrastructures and peace consolidation.","Mozambique is the African country with the second largest amount of EU financial support, estimated at about 700 million Euros annually to implement various social and economic development projects.",All Africa News,https://allafrica.com/stories/202202090152.html
164,카메룬,2022-02-08,공여국,거버넌스평화,"프랑스, 카메룬 IMF 프로그램 위한 2022년 460억 세파 지원 약속","카메룬을 방문한 레미 리우(Rmy Rioux) 프랑스 개발청(AFD) 사무총장은 지난 2월 4일, 국제통화기금(IMF) 신규 경제·금융 프로그램 예산지원을 위해 카메룬 정부와 1억5000만 유로(한화 약 1,968억원)에 달하는 “복수트란셰 기본 협정”을 체결함. 동 협정에 따르면 2022년 프랑스 예산지원금 7천만 유로(한화 약 932억원)가 1차 지급액으로 결정되었으며, 2024년 카메룬-IMF 간 프로그램 종료일까지 순차적으로 지급될 예정임.","프랑스는 2016년부터 카메룬의 IMF 경제·금융 프로그램 하에서 프랑스개발청을 통해 3억 유로(한화 약 3,940억원)를 지원함. 알라만 우스만 메이(Alamine Ousmane Mey) 경제기획부 장관이 “올해부터 2024년까지 진행될 프로그램에 따라 프랑스는 1억 5000만 유로(한화 약 1,970억 원)를 지원하고 있으며 2022년 예상 지출 금액은 7000만유로(한화 약 932억원)”라고 밝힌 바에 따르면, 프랑스의 카메룬 IMF 프로그램 예산지원금이 그간 지원해오던 규모에 비해 50% 감소한 것으로 보임.","국제통화기금 집행이사회가 카메룬 경제·금융 프로그램을 승인한 것은 2021년 7월 29일이었으며, 이 프로그램의 3년간의 수행을 위해 브레턴우즈(Bretton Woods) 기관이  6억 8,950만 달러(한화 약 7,500억원)의 차관을 지원함.",France commits to disburse CFAF 46 billion in 2022 to support Cameroon's IMF program,"During a visit to Cameroon, the Director General of the French Development Agency (AFD), Rmy Rioux, signed on February 4, 2022 with the Cameroonian government, a ""multi-tranche framework agreement"" amounting to 150 million euros (98.4 billion CFA francs), as part of the budget support loan granted by France to the State of Cameroon, in order to support the new economic and financial program with the International Monetary Fund (IMF). This ""multi-tranche framework agreement"" comes with an initial disbursement of 70 million euros (CFAF 45.9 billion), representing the 2022 tranche of these budgetary supports from France, which will be progressively disbursed until 2024, the date of the end of the new ongoing program between Cameroon and the IMF.","""Since 2016, under Cameroon's IMF-supported economic and financial program, France, through AFD, has provided support of €300 million (about CFAF 197 billion). This time, under the 2022-2024 program, France is providing support of 150 million euros, with a probable disbursement of 70 million euros for the year 2022,"" said Alamine Ousmane Mey, Cameroon's Minister of the Economy. The statement by this member of the government, however, reveals a significant reduction (-50%) in budgetary support from France between Cameroon's two three-year programs with the IMF.","As a reminder, it was on July 29, 2021 that the IMF Executive Board approved the new economic and financial program with Cameroon, which runs until 2024. This program is accompanied by a credit amount of 689.5 million dollars (nearly 375 billion CFA francs) to be disbursed by this Bretton Woods institution, to accompany the economic and financial reform program of Cameroon over a period of 3 years.",Investir Au Cameroun,https://www.investiraucameroun.com/economie/0802-17479-la-france-s-engage-a-decaisser-46-milliards-de-fcfa-en-2022-pour-soutenir-le-programme-du-cameroun-avec-le-fmi
165,르완다,2022-02-08,수원국,기후행동,순환 경제: 르완다에서 수집되는 10% 미만의 전자 폐기물,"순환 경제는 제로 웨이스트를 목표로 하는 경제 시스템으로, 정부의 순환 경제 정책에도 불구하고 전자폐기물 수거율이 낮아 페기물 관리 주체에 따른 수집 전략 개선이 필요한 것으로 확인됨","르완다에서 매년 10,000-15,000톤의 전자 폐기물이 발새하는 것으로 예상하나, 그 중 10% 미만만 매년 전국의 가정에서 수집되고 있음 ",가정에서 전자 페기물 수거를 개선하기 위해 더 많은 청년들이 전자 폐기물 관리 사슬에 참여하도록 교육받고 있다고 함,Circular economy: Less than 10% of e-waste is collected in Rwanda,"Despite the government’s policy to promote a circular economy, there is a need for improved strategies in collecting electronic waste for recycling according to players in waste management. Circular economy is an economic system that targets zero waste and pollution.","Between 10,000 tons and 15,000 tonnes  of electronic waste are expected to be collected every year in Rwanda. However less than 10 per cent of that is annually being collected from homes across the country.","In order to improve electronic waste collection from households, Mbera  said, more youth are being trained to be engaged in the e-waste management chain.",Newtimes (Online),https://www.newtimes.co.rw/business/circular-economy-less-10-e-waste-collected-rwanda
166,스리랑카,2022-02-08,국제기구,보건,"UNDP, 스리랑카의 의료폐기물 관리 평가로 중대한 과제를 밝혀냄","UNDP는 스리랑카 보건부(MoH)의 요청에 따라 2020년 8월부터 2021년 3월까지 세계보건기구(WHO), 유엔아동기금(UNICEF)과 공동으로 의료 폐기물 평가를 실시함.","신속한 평가 결과를 기반으로, 모든 의료 분야 이해관계자들을 고려한 주요 권고안이 제시됨. 권고안에는 폐기물 처리기에 적용된 지불 시스템을 통해 Ayurvedic 처리 센터를 포함한 민간 의료 종사자에 의한 임상 폐기물 처리 공식화, 임상 폐기물의 공개적인 소각을 엄격히 금지하고 HCFs에서 폐기물 처리를 위한 적절한 조치를 도입하기 등이 있음. ",,UNDP’s assessment on health care waste management in Sri Lanka identifies critical challenges,"UNDP in Sri Lanka at the request of the Ministry of Health (MoH) in Sri Lanka, in collaboration with the World Health Organization (WHO) and the United Nations Children’s Fund (UNICEF), conducted a rapid assessment of Health Care Waste Management in healthcare settings in Sri Lanka from August 2020 to March 2021.","Based on the outcomes of the rapid assessment, key recommendations have been made for the consideration of all healthcare sector stakeholders. Formalizing clinical waste disposal by private practitioners including Ayurvedic treatment centers with a payment system imposed upon the waste generators; Strictly enforce the prohibition of open burning of clinical waste and introducing suitable arrangements for waste treatment at HCFs.",,Colombo page,http://www.colombopage.com/archive_22A/Feb08_1644339006CH.php
167,베트남,2022-02-08,수원국,기후행동,2030년 국가 생물 다양성 전략 승인,Le Van Thanh 베트남 부총리는 2050년 비전 2030년 국가 생물 다양성 전략을 승인하는 결의안에 서명함.,"정부는 생태계 보호구역을 국토 면적의 9%로, 해양 및 연안 보호 구역을 전체 해역의 3~5%로 늘리는 것을 목표로 하고 있음. 한편 산림보호구역은 42~43% 수준으로 유지되며, 훼손된 생태계 면적 중 최소 20%가 복원될 것으로 기대됨. 야생 동물, 특히 멸종위기종과 희귀종을 보존하는 것에 우선순위를 둘 것임.","2050년 비전을 통해 주요 자연 생태계, 멸종위기종, 희귀한 유전자원을 효과적으로 보존할 수 있음. 동 전략은 생물다양성 보전 및 복원 강화, 멸종위기 야생종 보전 및 복원, 유전자원 보존 강화, 생물다양성 훼손 활동 통제 등의 핵심 과제를 제시함.",National biodiversity strategy to 2030 approved,Deputy Prime Minister Le Van Thanh has signed a decision approving the national biodiversity strategy to 2030 with a vision towards 2050.,"The Government targets increasing the area of protected ecosystems to 9% of the country's land area, and protected marine and coastal areas to 3-5% of the total sea area. Meanwhile, forest coverage is expected to sustain at 42-43% and at least 20% of the degraded ecosystem area will be restored. Priorities are given to conservation of wildlife species, particularly endangered, rare and precious species of plants and animals.","With a vision towards 2050, major natural ecosystems, endangered species, and precious and rare genetic resources will be restored and effectively preserved. The strategy sets out key tasks such as intensifying biodiversity conservation and restoration, conserving and restoring endangered wild species, stepping up the conservation of genetic resources, and controlling activities that would harm biodiversity.",Vietnam Investment Review,https://vir.com.vn/national-biodiversity-strategy-to-2030-approved-91129.html
168,키르기스스탄,2022-02-08,공여국,에너지,"에너지, 무역, 관광: 이란, 키르기스스탄과 협력 개발 목표",키르기스스탄은 이란의 경제체들과 무역할 수 있는 많은 기회와 이점을 가지고 있다. 비슈케크 사이드 카라지 주재 이란 전권대사는 기자회견에서 발표했다.,그에 따르면 이란 정부는 키르기스 공화국이 필요로 하는 물자 수송을 위해 자국 항만시설과 특혜를 제공할 준비가 되어 있다고 밝혔다.,"이란의 축적된 수력발전소 건설 경험은 키르기스스탄 정부가 활용할 수 있는 좋은 기회다. 석유 및 석유화학 분야의 경우 이란도 공화국의 요구 사항을 일부 충족할 수 있다. 그는 ""2022년 상호 고위급 방문의 결과로 향후 몇 달 동안 양국 관계가 역동적으로 발전하는 것을 목격하기를 희망한다""고 언급했다.","Energy, trade, tourism: Iran aims to develop cooperation with Kyrgyzstan",Kyrgyzstan has many opportunities and advantages for trade with economic entities of Iran. The Ambassador Extraordinary and Plenipotentiary of Iran to Bishkek Saeed Kharazi announced at a press conference.,"According to him, the Iranian government has declared its readiness to provide its port facilities and preferences for the transportation of goods needed by the Kyrgyz Republic.","Iran’s accumulated experience in the construction of hydroelectric power plants is a good opportunity that the Kyrgyz government can use. As for oil and petrochemical sectors, Iran can also meet a part of the needs of your republic. I hope that as a result of reciprocal high-level visits in 2022, we will witness a dynamic development of relations between the two countries in the coming months, the Ambassador noted.",24.kg,https://24.kg/english/223222_Energy_trade_tourism_Iran_aims_to_develop_cooperation_with_Kyrgyzstan/
169,방글라데시,2022-02-08,수원국,기타,"방글라데시, 최빈국(LDC) 졸업 이후 수출 실적 14.28% 감소할 수 있어",무역 특혜를 부여받았던 방글라데시는 최빈국 졸업 이후 더 큰 역경과 엄격한 원산지 규정(RoO)에 직면해 수출 실적이 크게 감소할 수 있음.,유엔기구 보고서는 방글라데시의 무역특혜와 국내 상황에 대한 의존도가 압도적으로 높기 때문에 최빈국을 졸업하는 다른 아시아 국가들에 비해 무역손실 전망이 클 것으로 예상함.,최근 UNCTAD 보고서에 따르면 방글라데시는 최빈국(LDC) 지위에서 개발도상국으로 졸업 후 매년 14.28% 또는 57억 3천만 달러 상당의 수출 이익이 감소될 수 있음.,Bangladesh may lose 14.28pc export earnings after LDC graduation,"Bangladesh may lose out significantly for facing greater adversities and stricter rules-of-origin (RoO) requirements in export destinations, where it enjoys trade preferences, after its LDC graduation.","A UN agency report predicts that Bangladesh's prospect of trade loss is greater compared to other Asian graduating countries, because of the country's overwhelming dependence on trade preferences and other factors on the domestic front.","The country is likely to lose 14.28 per cent or US$5.73 billion worth of export earnings annually after its graduation to a developing nation from the least-developed country (LDC) status, says the latest UNCTAD report.",The Financial Express,https://thefinancialexpress.com.bd/trade/bangladesh-may-lose-1428pc-export-earnings-after-ldc-graduation-1644288766
170,방글라데시,2022-02-08,수원국,보건,"방글라데시 보건부 장관, 연말까지 방글라데시 전국민 백신접종 완료할 것",방글라데시 전국민은 12월까지 2차례의 코로나19 백신과 부스터샷을 접종받게 될 것임.,"보건부 장관은 ""방글라데시의 백신 접종 계획은 성공적이었으며 현재까지 약 1억명의 사람들이 백신을 접종받았다"" 라고 말함.",또한 지금까지 자국민에게 백신을 접종하기 위해 2천억TK 이상을 지출했다고 덧붙임. ,All Bangladeshis to be fully vaccinated by year-end: Health Minister,All citizens of the country will get two doses of vaccine and the booster dose against Covid-19 by December.,"""Bangladesh has been successful in its vaccination campaign. Around 10 crore people in the country have been vaccinated so far, said health minister.","The minister said the government has so far spent more than Tk 20,000 crore on vaccinating people of the country.",The Daily Star,https://www.thedailystar.net/health/disease/coronavirus/fallouts-fightback/vaccine/news/all-bangladeshis-be-fully-vaccinated-year-end-health-minister-2956396
