,국가,날짜,구분,분야,제목,본문1,본문2,본문3,제목_현지공용어,본문1_현지공용어,본문2_현지공용어,본문3_현지공용어,출처,링크
314,튀니지,2022-02-14,국제기구,인권,"WB 중동·북아프리카 지역 부사장, 사회부 장관과 회의에서 사회 복지 통합 논의",Malek Zahi 사회부 장관과 Ferid Belhaj 세계은행(WB) MENA 지역 부사장이 참석한 가운데 열린 이번 회의에서 튀니지 내 사회복지를 강화하고 코로나19의 세계적 유행이 취약계층에 미치는 영향을 완화하기 위한 프로젝트가 논의됨. Zahi 장관은 특히 현재의 도전에 직면한 튀니지와의 파트너십에서 WB의 노력을 높이 평가함.,사회부 장관은 취약계층을 대상으로 한 새로운 프로그램과 팬데믹으로 인해 발생하고 지난 10년 동안 발생한 사회 현상을 대처하기 위한 프로그램에 대해 심사숙고하길 요청함.,Ferid Belhaj 부사장은 취약계층에 대한 지원 강화가 절실하다고 주장하며 다양한 분야에서 튀니지에 대한 지속적인 지원을 강조함.,Social welfare consolidation project at centre of MOSA meeting with WB VP for MENA,"A working session held on Monday between Social Affairs Minister Malek Zahi and World Bank Vice President for the MENA Ferid Belhaj followed up on the project to strengthen social welfare in Tunisia and alleviate the repercussions of the COVID-19 pandemic on vulnerable groups. According to a ministry statement, Zahi praised the efforts made by the WB within the framework of its partnership with Tunisia, particularly in the face of current challenges.",The Minister of Social Affairs called for reflection on new programmes targeting vulnerable groups and dealing with the social phenomena generated by the pandemic and occurring during the last 10 years.,"For his part, Ferid Belhaj stressed the ongoing support provided to Tunisia in various fields, insisting on the imperative of strengthening aid to vulnerable groups.",TAP(Tunis Afrique Press),https://www.tap.info.tn/en/Portal-Society/14878837-social-welfare
315,방글라데시,2022-02-14,수원국,에너지,"모멘 외교부 장관, 방글라데시의 재생 에너지 잠재력 맵핑 위해 국제재생에너지기구(IRENA)에 지원 요청",외교부 장관은 방글라데시에 대한 국제재생에너지기구(IRENA)의 기술적 및 재정적 지원을 요청함.,이는 방글라데시의 재생 에너지 잠재력에 대한 타당성 조사 및 맵핑을 위한 지원 요청임.,외교부 장관은 금요일 아부다비에 위치한 IRENA 본부에서 프란체스코 라 카메라 IRENA 사무총장과 회담을 가짐.,Momen seeks IRENA’s support for mapping renewable energy potentials in Bangladesh,Foreign Minister has sought International Renewable Energy Agency’s (IRENA) technical and financial support to Bangladesh,The support was sought for feasibility study and mapping of the renewable energy potentials in Bangladesh,Foreign Minister met Director General of the IRENA Francesco La Camer at its headquarters’ in Abu Dhabi on Friday.,Daily Sun,https://www.daily-sun.com/post/605020/Momen-seeks-IRENA%E2%80%99s-support-for-mapping-renewable-energy-potentials-in-Bangladesh
316,콜롬비아,2022-02-14,수원국,기타,외무부가 멕시코 공항에서의 자국민 대우 개선을 약속함.,"제3차 전략관계 이사회에서 외교부 장관에게 멕시코에서 입국하지 않는 자국민 상황을 해결하자는 제안이 왔고, 양국은 외교부에 대표단 파견을 약속함.",양국 대표는 이민 당국이 신청 기준을 통일할 수 있도록 제안된 실행 계획을 분석함.,"이후 멕시코 대표단은\ 콜롬비아에서 시행되는 출입국 관리 프로세스, 자동화 시스템, 국제선 탑승 구역 등에 알아보기 위해 엘도라도 국제공항을 방문함.",Cancillera logra acuerdos para reducir el nmero de inadmitidos y mejorar el trato para los connacionales en los aeropuertos de Mxico,"En la III Reunin del Consejo de la Relacin Estratgica se entreg al Secretario de Relaciones Exteriores, la propuesta de abordar la situacin de los connacionales inadmitidos en Mxico, por parte ambos pases se estableci un compromiso para enviar una delegacin a la Cancillera, para lograr un acuerdo en la materia.","Los delegados de ambos pases analizaron el plan de accin propuesto, con el propsito de definir las gestiones necesarias por parte de las autoridades migratorias, para unificar los criterios de aplicacin y poder trabajar conjuntamente en la implementacin de la propuesta. ","Posteriormente, los viceministros debern presentar en reunin plenaria los principales resultados y acuerdos alcanzados. Por parte de la delegacin mexicana se realiz una visita al Aeropuerto Internacional El Dorado para conocer el proceso de control migratorio implementado en Colombia, los sistemas automatizados y las diferentes reas y salas de abordaje internacional.",,https://www.cancilleria.gov.co/newsroom/news/cancilleria-logra-acuerdos-reducir-numero-inadmitidos-mejorar-trato-connacionales
317,케냐,2022-02-14,수원국,교육,중학교 교사들 대상으로 10개월간 연수 실시,케냐 교육부 George Magoha 장관은 중학교 교사들을 대상으로 10개월간 연수를 실시할 계획이라고 밝혔다.,"역량 기반 커리큘럼(Competency-Based Curriculum, CBC)이 새로 도입되면서 7학년, 8학년이 중학교로 편입된 데 따른 결정이다.","CBC로의 전환을 위해 케냐 정부는 교육부에 80억 실링(약 6천만 달러)을 지원하고 중학교들에 총 만 개 학급을 설치하도록 했다. 교육부는 공립 중학교들의 학급 부족 문제를 해결하고, 2023년 1월 6학년들이 원활하게 중학교로 진학하는 것을 목표로 하고 있다.","Junior High School Teachers To Undergo A 10-Month Training, CS Magoha Says","Teachers who will be handling the upcoming junior high school classes will be undergo a fresh 10-month training, Education Cabinet Secretary George Magoha has announced. ",This comes after the introduction of junior high school levels of education consisting of Grade 7 and Grade 8 under the new Competency-Based Curriculum (CBC).,"The government had released Ksh 8 billion to the Ministry of Education through Treasury to assist in the construction of 10,000 classes in secondary schools to ease the transition to the Competency-Based Curriculum (CBC) program. The program seeks to address the classroom deficit in the public secondary schools to allow for a smooth transition of CBC Grade 6 learners to Junior Secondary in January 2023.",Citizen Digital News,https://www.citizen.digital/news/junior-high-school-teachers-to-undergo-a-10-month-training-cs-magoha-says-n292412
318,콜롬비아,2022-02-14,수원국,과학기술혁신,"콜롬비아와 우루과이, 과학 기술 및 혁신 분야의 발전을 위해 세 가지 협력을 시작하다.",과학 기술 및 혁신을 강화하기 위한 콜롬비아 대통령의 요청에 따라 티토 호세 장관은 우루과이 공과 대학과 교육 의향서에 서명함. ,"이러한 작업 도구는 콜롬비아가 수행한 국제 활동의 일부이며, 교육공간, 세미나, 워크숍, 인적자원 형성, 우수 사례 및 지식 공유 등이 포함될 예정임.",장관은 우루과이 방문 중 교육 의향서에 서명하며 국가의 사회 경제적 발전을 촉진하는데 큰 역할을 한 것으로 평가됨.,"Colombia y Uruguay iniciaron tres instrumentos de cooperacin para apalancar el desarrollo de la ciencia, la tecnologa y la innovacin","De acuerdo a la solicitud del mandatario de Colombia de fortalecer los avances en ciencia, tecnologa e innovacin, el ministro Tito Jos Crissien, firm un Memorando de Entendimiento con la Universidad Tecnolgica de Uruguay, una Carta de Intencin con el Ministerio de Educacin y Cultura, y se estableci, junto a la Agencia Nacional de Innovacin e Investigacin uruguaya (ANNI), Mesas Bilaterales de Trabajo","Estas herramientas de trabajo hacen parte de las acciones internacionales adelantadas por Colombia, las cuales son percibidas de forma positiva ya que representa un progreso para el ecosistema cientfico de ambos pases, cooperando a travs de mecanismos como la organizacin de espacios de capacitacin, seminarios, talleres, actividades de formacin de capital humano, de intercambio cientfico y transferencia de buenas prcticas","En su visita a Uruguay, tambin consolid las relaciones cientficas firmando una Carta de Intencin con el Ministerio de Educacin y Cultura Uruguayo, para realizar acciones conjuntas las cuales estarn centradas en promover el desarrollo socioeconmico de los pases sobre la base de la igualdad y el beneficio mutuo.",,https://minciencias.gov.co/sala_de_prensa/colombia-y-uruguay-iniciaron-tres-instrumentos-cooperacion-para-apalancar-el
319,감비아,2022-02-14,수원국,보건,"감비아 내 HIV 보균자, 24,000명 정도로 추정","1986년부터 HIV 바이러스가 확산됐음에도 불구하고, 아직까지 많은 에이즈 환자들이 차별과 낙인 속에 살아가고 있음. 감비아의 경우 약 24,000명의 사람들이 에이즈 보균자이며, 그 중 51%에 불과한 13,692명만이 보균 여부를 알고 있는 것으로 추정됨. 현재 에이즈에 대한 사람들의 인식은 코로나19의 증가로 인해 많이 줄어든 상태임. 최근 연구에 따르면 2013년에 국가 내 에이즈 보균자 비율은 1.9%였고, 이는 2019년 국가 추적 연구(NSS)에 의해 1.5%로 보안됨. 우려되는 부분 중 하나는 여성 매춘부의 에이즈 확진자 비율인데, 가장 최근 연구에 따르면 11%(354명 중 39명)의 여성 매춘부가 에이즈 바이러스 보균자이고 남성 동성 성관계자 중 35.5%(151명 중 52명)이 에이즈 바이러스 보균자인 것으로 나타남. National AIDS Secretariat(NAS)의 총 책임자인 Alpha Khan에 따르면 바이러스 보균 사실을 알고 있는 사람 중 61%만이 치료를 받고 있어 검사와 치료에 대한 접근이 개선되어야 한다고 함. ","감비아 정부는 National AIDS Control Programme(NACP)를 만들어 증가추세인 에이즈 바이러스를 관리를 해왔음. 2000년에는 정부가 에이즈 보균자의 권리를 향상하기 위한 다방면의 대응을 하는데 심혈을 기울이기도 했음. Khan은 이러한 노력이 대통령을 의장으로 하는 범분야 National AIDS Council (NAC)의 창설로 이어졌으며 2021년에는, 범분야 협력을 지원하는 대통령 직속의 산하기구가 생기기도 했다고 밝힘. 그는 ""편견이 감비아의 에이즈 대응에 가장 큰 문제""라며 ""에이즈 보균자들은 자신의 상태에 대해 알아야 하지만 에이즈에 대한 편견과 차별이 에이즈 바이러스 검사를 막고 있다""라고 말함.","감비아에는 이미 이 문제를 관리하기 위한 견고한 법적, 산업적 프레임워크가 있음. 감비아는 정부와 공여자, 핵심이해관계자 간 파트너십이 만들어낸 전략 계획을 가지고 있고, 프로그램의 운영 또한 기록되고 있는 중임. Khan에 따르면 NAS의 접근은 공공보건적 접근으로, 치료, 관리, 서비스 지원이 제공되고 있고 대부분의 보건 시설 관련 정책과 관계 분야 협력이 NAS의 관리 아래에 이뤄지고 있음. 해당 지원 내용에는 노출 후 관리(PEP), 에이즈 상담 및 검사(HCT), 모자감염 차단 (PMTCT), 에이즈 클리닉이 포함돼 있음.","Alarming: Estimated 24,000 people living with HIV in Gambia","Despite the existence of HIV since March 1986, many people living with the Virus (PLHIV) have been affected and some have undergone some stigma and discrimination. In The Gambia, it is estimated that 24,000 people are living with HIV (2020), and only 13, 692 (51%) know their HIV status. Currently, people tend to forget about the virus due to the increase in Covid-19 cases and its new variants. According to recent studies, HIV prevalence in the country is 1.9% DHS in 2013 and this was complemented by the recent preliminary result of the National Sentinel Study (NSS) in 2019 at a prevalence of 1.5%. The prevalence in other cohorts that is a bit worrying is the female sex latest study that indicates the prevalence of HIV among Female Sex workers (SFW) was 11% (39/354) and 35.5% (52/151) among men who have sex with Men (MSM). Mr. Alpha Khan, the deputy director of National AIDS Secretariat (NAS), said of those who know their status, 8294 (61%) is currently receiving treatment, adding they have to improve access to testing and treatment. Many PLHIV in the country find it difficult to live happily and free from stress and receive the extreme support they need from family members or friends. Mr. Khan said “stigma and discrimination” also continue to be a compounding factor.","The government of The Gambia initially addressed the emerging HIV epidemic in the country through a health sector response with the creation of the National AIDS Control Programme (NACP). In 2000, the government committed itself to a comprehensive multi-sectoral response with the protection of the rights of People Living with HIV (PLHIV). Mr. Khan said the commitment led to the creation of the multi-sectoral National AIDS Council (NAC) chaired by the President, adding that in 2001, the NAS was also established under the Office of the President to coordinate the multi-sectoral response. Khan added that since then, “significant achievements have been realised in the fight against HIV and Aids in The Gambia"". “Stigma remains the biggest challenge for the HIV programme. People need to know their status through testing but because of the stigma and discrimination within the community they are afraid of HIV test.”","There is a relatively robust legislative and institutional framework for addressing the scourge, the country has a strategic plan around which partnerships between government, donors, and key stakeholders have been forged, and there is a track record of programme implementation. The fact remains that HIV can also expose oneself by weakening the immune system and giving advantage to infections like TB, pneumonia, and diarrhoea that can kill. NAS approach towards the PLHIVs is the public health approach; Khan said, adding the programme provides treatment, care, and support services; under the purview of NAS are mostly coordination and health facility-based interventions. He said these include Post Exposure Prophylaxis (PEP), HIV Counseling and Testing (HCT), Prevention of Mother to Child Transmission (PMTCT), HIV Clinical Care, and Anti-Retroviral Therapy (ART), in addition to the ongoing programme management. ",The point,https://thepoint.gm/africa/gambia/headlines/alarming-estimated-24000-people-living-with-hiv-in-gambia
320,베트남,2022-02-14,수원국,교통,"베트남 정부, 2030년까지 고속도로 5,000km 연장 계획","작년 9월, 총리의 승인을 받은 2050년 비전, 2021-2030년 도로망계획에 따르면, 2050년까지 41개의 경로를 연결한 총 9,014km의 국가 고속도로망이 완공될 예정임.","북부지역에는 4~6차선의 도로 14개가 조성될 예정이며 총 2,305km에 달할 것으로 보임. 중부고원지역은 4~6차선의 도로 10개가 구축될 예정이며 총 1,431km로 예상됨. 남부지역은 4~10차선의 고속도로 10개가 연결될 예정이며 총 1,290km로 예상됨. ","이 고속도로망 계획은 랑선(Lang Son)과 까마우(Ca Mau)를 잇는 동쪽 남북고속도로와 북부지역, 중부지역과 중부고원지역, 남부지역과 남부 메콩델타 지역을 잇는 고속도로 그리고 하노이와 호치민의 순환도로 등 일부 주요 도로를 우선적으로 구축할 예정임.","Gov't plans to raise combined length of expressways to 5,000 km by 2030","By 2050, the national expressway network will be basically completed with 41 routes, totaling about 9,014 km, according to the road network plan for the 2021 - 2030 period, with a vision to 2050, approved by the Prime Minister in September last year.","In the Northern region, there will be 14 roads, totaling about 2,305 km, with 4-6 lanes. The Central Region - Central Highlands will have 10 roads, about 1,431 km in length, with 4-6 lanes. The Southern region will consist of 10 expressways, about 1,290 km in length, with 4 - 10 lanes.","The planning gives priority to building some key roads, including the north-south expressway in the east from Lang Son to Ca Mau, expressways connecting the northern region, the central region with the Central Highlands, the Southeast region and the Mekong River Delta, and the ring roads of Hanoi and Ho Chi Minh City.",Government News,https://en.baochinhphu.vn/govt-plans-to-raise-combined-length-of-expressways-to-5000-km-by-2030-1112202142349164.htm
321,에티오피아,2022-02-14,공여국,기후행동,"USAID, 에티오피아 가뭄위기에 대응하기 위해 3,900만 달러 이상 지원","USAID는 에티오피아에 지속되고 있는 가뭄상황에 대응하기 위해  3,900만 달러 이상을 지원하겠다고 밝혔다. 2022년에는 620만 명 이상이 긴급 식량 지원이 필요한 것으로 추산되며 USAID는 에티오피아를 포함한 동아프리카 지역에 지원을 확대하기 위해 노력하고 있다.","이 가뭄은 에티오피아의 남부와 동남부에 뚜렷하게 나타나고 잇다. 심각한 식수부족과 가축폐사에 대응하여 UN 세계식량계획은 USAID 파트너사를 통해 난민 160만명에게 식량을 지원할 예정이다. 금번 지원을 통해  340만 명을 위한 식량, 30만 명의 어린이에 대한 긴급 영양공급, 안전한 식수, 위생, 건강 관리 및 새계를 위한 가축 지원 등이 가능할 것으로 예상된다.",,USAID Providing more than $39 million in Humaniterian assistance to respond to drought in Ethiopia.  ,U.S. Agency for International Development (USAID) is providing more than $39 million in response to devastating drought in Ethiopia. An estimated more than 6.2 million people are in need of urgent food assistance in 2022 and USAID is working to scale its assistance to the Horn of Africa including Ethiopia to respond to the driest condition.,"The drought is very visible in the southern and southern east of Ethiopia with reports of diminishing pastoral lands, significant crops losses. Severe water shortages and livestock deaths. Through USAID partner the UN World Food Program, will provide 1.6 million drought-affected Ethiopians and refugees with food assistance. The assistance includes: food for 3.4 million people, emergency nutrition to 300,000 children and support for safe drinking water, sanitation, and hygiene, health care and livestock  ",,USAID,https://www.usaid.gov/news-information/press-releases/feb-14-2022-usaid-providing-more-39-million-humanitarian-assistance-respond
322,르완다,2022-02-14,수원국,교육,"르완다 교육부(Ministry of Education), 학교 급식 프로그램 참여 확대 ",교육부는 초·중등학교 급식비 분담금을 늘리는 방안을 검토 중이지만 현재 프로그램 격차를 해소하기 위해서는 학부모들의 기여가 필요함을 밝힘,현재 교육부는 점심 급식에 자녀 1명당 매일 RWF 56을 기부하고 있으며 학부모는 RWF94를 기부하고 있음. 그러나 교사들은 현재 시세에 비해 편성된 예산규모가 작다는 의견임 ,"지금까지 학교 급식 프로그램은 이미 600개의 초중등학교에서 시행되고 있으며, 지역사회에서 쉽게 구할 수 있는 음식으로 급식을 운영할 것을 권장하고 있음. 교육부는 초중등학교 학생 330만명이 급식을 이용할 수 하겠다고 밝힘",Ministry Of Education To Increase Contribution To School Feeding Programme,"The Ministry of Education is considering to increase its contribution to school feeding in Primary and secondary schools, but calls for parents to follow suit in order to bridge current gap in the program.","Currently, the Ministry of education contributes Rwf56 per child per day for lunch, while parents contribute Rwf 94. The two players contribute a total of Rwf150 for each child to have lunch. However, teachers say it is small, compared to the current market price.","So far, the school feeding program is already working in 600 primary and secondary schools with officials encouraging schools to feed students with the most available food in their communities. The Ministry of Education says it targets to feed 3.3million children in both primary and secondary schools.",Ktpress (Online),https://www.ktpress.rw/2022/02/ministry-of-education-to-increase-contribution-to-school-feeding-programme/
323,캄보디아,2022-02-14,수원국,교육,"노동직업훈련부, TVET에 대한 월드뱅크의 지원 요청",노동 직업 훈련부는 월드뱅크에 기술 및 직업 교육 훈련(TVET)을 추가로 지원하여 젊은이들이 노동 시장의 현재 수요에 맞춘 기술을 교육을 제공하도록 요청함. 이 요청은 노동부 장관 Ith Samheng이 2월 14일 동아시아 태평양 지역의 사회 보호 및 일자리 관리자이자 월드뱅크 대표 Yasser El-Gammal과의 만남에서 언급됨. ,"동 회의는 고용주의 수요에 맞추면서도 청년들을 위한 양질의 일자리를 창출함으로써 캄보디아의 소득 및 생산성 제고에 기여하기 위한 월드뱅크의 직업교육 및 노동 이동(지역,산업 간 이동) 지원전략을 논의하기 위한 자리였음.","노동직업훈련부는 또한 아시아 개발 은행(ADB) 및 프랑스 개발청(AFD)의 전문가들과 교육, 기술 및 직업 훈련, 경쟁력 향상 프로젝트(S4C) 개발 프로젝트에 관한 협약을 체결하였음. 이 프로젝트는 TVET의 질을 개선하고 노동 시장의 요구를 충족시키는 것을 목표로 하고 있으며, S4C 프로젝트의 일환으로, TVET 캄보디아는 기술 및 직업 교육, 석사 학위, 준학사 학위, 기술 및 전문 학위의 품질과 대응력 강화를 비롯해 산업체와의 파트너십을 통한 직장 훈련 등을 포함하여 3가지 주요 우선 순위 영역에 중점을 두고 있음. ",World Bank asked to support TVET,"The Ministry of Labour and Vocational Training requested that the World Bank further support Technical and Vocational Education and Training (TVET) to develop the skills young people will need to meet the current demands of the labour market. The request came as labour minister Ith Samheng met virtually with World Bank representative Yasser El-Gammal, manager of social protection and jobs for the East Asia and Pacific Region, on February 14.",The meeting aimed to discuss some of the ways that the World Bank can support the development of skills and mobility of labour in Cambodia. The aim of these strategies is to meet the needs of employers so that young people attain quality jobs which will increase their incomes and the productivity of Cambodia.,"The ministry also signed agreements with experts from the Asian Development Bank (ADB) and the French Development Agency (AFD) on development projects in education, technical and vocational training, and the Skills for Competitiveness Project (S4C). These projects aim to improve the quality of TVET and to meet the needs of the labour market. As part of the S4C project, TVET Cambodia has been focusing on three major priority areas, including strengthening the quality and responsiveness of technical and vocational education, master’s degrees, associate degrees, technical and specialised degrees and in training in the workplace through partnerships with industry. ",Phnom Penh Post,https://www.phnompenhpost.com/national/world-bank-asked-support-tvet
