,국가,날짜,구분,분야,제목,본문1,본문2,본문3,제목_현지공용어,본문1_현지공용어,본문2_현지공용어,본문3_현지공용어,출처,링크
484,인도네시아,2022-02-21,수원국,보건,인도네시아 5개의 주에서는 코로나19 정점 이미 지나,인니정부는 월요일(2.21) 수도 자카르타를 포함한 최소 5개 주에서 코로나19의 정점을 지났다고 주장함.,"인도네시아는 지난 24시간 동안 34,418명의 새로운 사례를 기록했으며, 이는 전날보다 거의 10,000건이 감소한 수치임. 가장 높은 일일 집계는 2월 16일에 기록된 64,718건으로 오미크론 변종에 의해 촉발된 새로운 감염이 갑자기 급증함. 부디 구나디 사디킨 보건장관은 자카르타, 발리, 반텐, 말루쿠, 서부 누사텡가라에서 신규 확진자가 감소하고 있다고 말했음.","그러나 보건부 장관은  매일 Covid-19 사망자 수가 앞으로 2주까지 계속 증가할 수 있다고 말했음. 인도네시아는 월요일 사망자 176명을 포함해 지난주 평균 175명의 코로나바이러스 관련 사망자를 기록함. 장관은 ""자카르타와 발리 등 여러 지역에서 신규 확진자가 감소했지만 코로나19 사망자는 아마도 2주 후에 정점에 도달할 것""이라고 말했음.",Covid-19 Peak Has Passed in Five Provinces,The government claimed on Monday that at least five provinces including the national capital of Jakarta have seemingly passed the peak of their latest Covid-19 wave.,"Indonesia has recorded 34,418 new cases in the past 24 hours, down by nearly 10,000 cases from the previous day, government figures show. The highest daily tally was 64,718 cases recorded on February 16 amid a sudden surge in new infections triggered by the Omicron variant. Health Minister Budi Gunadi Sadikin said the number of new cases have been declining in Jakarta, Bali, Banten, Maluku, and West Nusa Tenggara.","“They have outnumbered the record high of the Delta variant wave and five provinces have passed their current peak,” Budi said in a virtual news conference. But Budi said the daily Covid-19 death toll may continue to increase until the next two weeks. Indonesia has been averaging 175 coronavirus-related deaths over the past week, including 176 deaths on Monday.",Jakart Globe,https://jakartaglobe.id/news/covid19-peak-has-passed-in-five-provinces
485,탄자니아,2022-02-21,수원국,기후행동,"다수 NGO, Morogoro 주에 10000그루 식재를 위해 협력","4개 NGO-탄자니아 지속가능 농업(SAT), Raleigh 탄자니아, Morogoro Kwanza Mazingira, Mwanamke na Mazingira는 Morogoro주 위원회의 나무 1만 그루 식재를 향한 노력을 지원하기 위해 협업을 약속함.","동 프로그램에 관련된 지역은 Kigurunyembe, Lupanda St. Peter's Seminary, Kilakala 중등학교, Kilakala and Mwande 초등학교를 포함함.",SAT는 Uluguru 산 기슭의 거주민들의 활동으로부터 비롯된 삼림벌채로 인한 녹지 소실을 복원하기 위한 지속가능한 프로그램을 가지고 있음.,"NGOs team up to plant 10,000 in Morogoro DC","Four NGOs-Sustainable Agriculture Tanzania(SAT), Raleigh Tanzania, Morogoro Kwanza Mazingira and Mwanamke na Mazingira have pledged to team up and support Morogoro District Council's effort towards planting 10,000 trees.","Areas to be involeved in the programme include Kigurunyembe, Lupanda St. Peter's Seminary, Kilakala secondary schools, and Kilakala and Mwande primary schools.",SAT has sustainable programs of restoring the green of the region that have been disappeard due to deforestation and human activities mainly to residents along the slopes of Uluguru Mountain.,IPP Media,https://www.ippmedia.com/en/features/ngos-team-plant-10000-morogoro-dc%C2%A0
486,볼리비아,2022-02-21,국제기구,농촌개발,FAO가 단기간에 볼리비아에서의 프로젝트를 4배로 늘릴 거라 예측,라틴아메리카와 카리브해 지역 유엔식량농업기구(FAO)의 대표인 훌리오 베르데게(Julio Berdegu)가 식품 안전에서의 우선 순위와 프로젝트를 4배로 늘리는 방향에 대해 정부와 논의하기 위해 볼리비아에 방문했다. ,FAO의 다른 방문 목적은 볼리비아 행정부가 경제 및 사회 회복을 위해 설정한 목표를 달성하는 데 FAO가 어떻게 도움이 될 수 있는지 알아보기 위해 국가 당국과 합의에 도달하는 것이다.,"베르데게는 기후 변화와 같은 문제에 직면할 볼리비아 조상 전래의 생산 시스템이 ""거대한 부""이자 ""생물 다양성, 생산 방식의 유전적 유산""이라는 점에서 ""큰 잠재력""을 갖고 있다고 강조했다.",,,,,swissinfo,https://www.swissinfo.ch/spa/fao-bolivia_la-fao-prev%C3%A9-cuadruplicar-sus-proyectos-en-bolivia-en-el-corto-plazo/47366906
487,인도네시아,2022-02-21,수원국,보건,"인니정부, 코로나19 대응를 위해 병원에 25조 루피아를 보전해줄 것",인니정부는 코로나19 환자용 병상 할당을 위해 추가로 25조 루피아(17억USD)를 병원에 보전해 줄것이라고 부디 구사디 사디킨 보건부 장관이 월요일(2.21) 발표함,작년 델타 변종으로 인해 새로운 감염사례가 급격히 증가한 가운데 전국의 병원은 코로나19 환자용 병상을 최소 20% 제공하도록 권장하였으며 금전적 인센티브를 약속한바 있음,"코로나19 환자를 치료하는데 민간 및 주립 병원이 부담하는 비용은 약 90조 루피아로 추산되지만 정부는 예산한계로 인해 여전히 25조 루피아의 빚을 지고 있음. 장관은 ""우리는 재부무와 협의중이며, 25조 루피아의 부채가 곧 상환될 것"" 이라 말했음",Gov’t to Reimburse Hospitals Rp 25 Trillion for Covid-19 Handling,"The government will pay back hospitals an additional Rp 25 trillion ($1.7 billion) for allocating beds for Covid-19 patients last year, Health Minister Budi Gunadi Sadikin said on Monday.",Hospitals across the country were encouraged to share at least 20 percent of their beds for Covid-19 patients and promised financial incentives amid a dramatic surge in new cases due to the Delta variant last year. ,"The total cost shouldered by private and state hospitals in treating Covid-19 patients was estimated at around Rp 90 trillion but the government still owed them Rp 25 trillion due to budget constraints. “We are coordinating with the Finance Ministry and the Rp 25 trillion debt will be repaid soon,” he said without mentioning when..",Jakart Globe,https://jakartaglobe.id/news/govt-to-reimburse-hospitals-rp-25-trillion-for-covid19-handling
488,이집트,2022-02-21,수원국,과학기술혁신,"이집트 교육부 장관, 이집트 기술교육 발전을 위한 첫 자문위원회 개최",타렉 샤우키 이집트 교육부 장관 주관하에 이집트 기술교육 발전을 위한 첫 자문위원회 회의를 개최하였음. 이번 회의는 기술교육 개혁 지원을 위한 자문위원회 구성을 위함이였으며 기술교육 발전의 주요 도전과제들과 기존 전략 수정 방안에 대해 논의하였음. ,"더 나아가, 교육부는 청년 경영 인재를 위한 시스템 개발에 가장 주요 도전 과제로 상업 교육의 발전을 제시하였음. ",또한 장관은 기술교육과 개혁 전략을 위한 주요 요인들과 이집트 비전 2030 달성에 있어 해당 요인들의 중요성을 점검하였음. ,Egypt’s Education Minister holds first Advisory Council meeting for developing technical education,Minister of Education Tarek Shawky headed on Monday the first meeting of the Advisory Council for the Development of Technical Education. The meeting aimed to establish an advisory council to support the technical education reform strategy. It also discussed the main challenges of developing the technical education system and ways to modify the existing strategy.,"Furthermore, the development of commercial education was one of the most important challenges that the ministry presented to the council in order to develop a system for graduating business pioneers.",Shawky also reviewed the most important features of the technical education development and reform strategy in addition to a brief presentation on its importance to achieving Egypt’s 2030 Vision.,Daily News Egypt,https://dailynewsegypt.com/2022/02/21/egypts-education-minister-holds-first-advisory-council-meeting-for-developing-technical-education/
489,이집트,2022-02-21,수원국,보건,"이집트, 일본 대사관 그리고 UNICEF, 이집트 내 백신 접종 범위 확장을 위한 350만 달러 규모 MOU 서명",라니아 알-마샤트 이집트 국제협력부 장관과 카레드 압델 가파르 이집트 보건부 대행 임석하에 주이집트 일본 대사관과 유니세프 간 약 380만 불 규모의 원조 협의 MOU 서명식이 개최되었음.  ,해당 MOU 체결은 이집트 정부의 코로나19 대응 지원과 다자간 및 양자간 개발협력 파트너들과의 협력 강화 지원을 통해 백신 접종 범위 확대 프로젝트 실행을  ,해당 프로젝트는 백신집종 센터의 수를 확대하고 백신 접종 가속화 방안을 통해 효과적인 백신접종이 목표임. ,"Egypt, Japanese Embassy in Cairo, UNICEF, sign grant agreement, MoU worth $3.5m to implement project to expand scope of vaccination in Egypt",Minister of International Cooperation Rania Al-Mashat and Acting Minister of Health and Population Khaled Abdel Ghaffar witnessed the signing of a grant agreement and a memorandum of understanding (MoU) between the Japanese Embassy in Cairo and UNICEF worth $3.5m.,The grant and MoU will cover the implementation of a project to expand the scope of vaccination against COVID-19 in Egypt within the framework of close cooperation between Egypt and multilateral and bilateral development partners to enhance development efforts and support the state’s plan to respond to the pandemic.,This project aims to ensure effective vaccination by increasing the number of vaccination centres through a number of proposed measures that promote the acceleration of the vaccination process.,Daily News Egypt,https://dailynewsegypt.com/2022/02/20/egypt-japanese-embassy-in-cairo-unicef-sign-grant-agreement-mou-worth-3-5m-to-implement-project-to-expand-scope-of-vaccination-in-egypt/
490,에티오피아,2022-02-22,수원국,기타,"에티오피아, 국가품질위원회 설립 추진","에티오피아 통상부(MoTRI)는 국가품질정책 초안의 검증을 마쳤으며, 이로써 공적영역과 사적영역으로 구성된 통합된 국가품질위원회를 설립할 수 있게 되었다. 관련해서, 2022년 2월 17일 80여 명의 다분야 이해관계자가 참여한 가운데 국가품질위원회 설립에 관한 최종 논의를 진행했으며, 의회는 이번 회계연도에 관련 정책을 의결할 것으로 예상된다. 에티오피아는 현재 아프리카 대륙자유무역협정(AFCTA)의 가동 준비를 하고 있으며 세계무역기구(WTO) 가입을 위한 협상도 빠르게 진행하고 있지만 품질제고 관련 정책이 부재하고 기존의 품질관리 시스템은 단편적인 접근 방식에 기초하고 있었다.","에티오피아 수출품들은 열악한 품질관리 인프라와 국가표준정책의 부재로 인한 저급한 품질관리로 국제시장에서 인정받지 못하고 있는 상황이다.  통상부 장관 Endalew Mekonen은 ""수출실적을 높이기 위해서 수출품 품질을 개선해야한다""고 강조하며, ""국가 품질 정책 도입을 통한 수출품 품질제고는 WTO에 가입하기 위한 중요한 요건 중 하나다.또한 에티오피아 내 외국인 투자자들이 자주 제기하는 질문 중 하나는 품질 보증과 품질 관리 정책이다""라고 덧붙였다. 따라서, 품질 관련 정책을 도입하는 것은 투자 흐름을 촉진하고, 지역 제조업체의 제품에 대한 책임의 소지를 명확히 하는데 도움이 될 것으로 예상된다. 품질 정책 초안은 아프리카 품질정책(Africa Quality Policy; AQP)에 의거하여 작성 되었으며, 아프리카 수출품이 지역 및 국제시장에서 경쟁력을 갖출 수 있도록 할 것이다. ",,Ethiopia steps forward to establish national quality council,"The Ministry of Trade and Regional Integration (MoTRI) has finalized the validation of a draft National Quality Policy. The policy, which is the first of its kind, enables the establishment of a National Quality Council, among others, comprised of both private and public institutions.  The Ministry conducted its final discussions with over 80 stakeholders participating on February 17, 2022. The Council of Ministers is expected to ratify the policy in the current fiscal year. Ethiopia is currently preparing to operationalize the African Continental Free Trade Agreement (AfCFTA) and is also fast-tracking the negotiation to join the World Trade Organization (WTO). However, Ethiopia had no quality policies before and the existing systems are based on fragmented approaches.","“Ethiopian export products have been facing quality complaint incidents in the international market. This is due to the absence of a strong quality infrastructure and standards. We must improve this, to improve our export performance,” said Endalew Mekonen, State Minister for the national quality infrastructure and assurance at the MoTRI.  It was stated that the policy is critical to attract Foreign Direct Investments (FDI). “Having a national Quality policy is one of the requirements to join the WTO. One of the frequent questions raised by foreign investors is quality assurance and its governing policies.  Thus, having such a policy will help to govern and regulate the investment flow and control the responsibilities of local manufacturers and products. The draft is crafted in-line with the Africa Quality Policy (AQP), which is ready for implementation by relevant parties to ensure African products are competitive in regional and international markets.",,The reporter news,https://www.thereporterethiopia.com/article/ethiopia-steps-forward-establish-national-quality-council
491,베트남,2022-02-22,공여국,농촌개발,"대한민국, 베트남 양식업 생산성 향상 원조","지난 21일, 대한민국 해양수산부는 부처 ODA 사업의 일환으로, 베트남 북부 지방 양식 생산성 향상을 위한 기술 협력 프로젝트를 시작했다고  밝힘.","이 사업은 2020년부터 2024년까지 45억 원(378만 달러)의 예산을 투입하여 30ha 달하는 맹그로브숲 복원사업을 진행하고 있는 대한민국 산림청과 양식 전문성을 지닌 해양수산부의 부처간 융합사업으로, 이를 통해 맹그로브숲을 복원하여 유기물이 풍부한 서식지를 복구하고, 패류 양식장을 조성하여 시너지를 낼 수 있을 것으로 기대함. ",,RoK aids aquaculture productivity enhancement in Vit Nam,"The Ministry of Oceans and Fisheries (MOF) of the RoK is implementing the first-year technical cooperation project for aquaculture productivity enhancement in Vit Nam’s northern provinces, as part of the ministry’s ODA endeavours, the ministry said on February 21.","As a model of interdepartmental collaboration that combines the Korea Forest Service’s ongoing mangrove reforestation efforts, covering 30 hectares for 2020-2024 with a budget of 4.5 billion KRW (US$3.78 million) and the MOF’s aquaculture expertise, the project is expected to restore habitats rich in organic matter through mangrove rehabilitation and create synergy with shellfish farming.",,Vietnam News,https://vietnamnews.vn/society/1157391/rok-aids-aquaculture-productivity-enhancement-in-viet-nam.html
492,캄보디아,2022-02-22,국제기구,기후행동,"세계은행, 폐기물 처리 사업장 5곳에 6천만달러 지원",캄보디아 정부부처와 세계은행은 캄보디아 5개 지역에서 고형 및 플라스틱 쓰레기 처리를 개선하기 위한 프로젝트 를 위해 세계은행이 6년 동안 약 6천만 달러를 지원할 것이라고 밝힘. ,"내무부 기능자원국 국장 Nov Nith 은 22일 인터뷰에서  현재 ""사업 시작 전 조사단계에 있으며 연관 부서의 의견 수렴이 2022년 3월 완료 예정""이라고 밝힘. 또한 동 사업은 내무부, 재정부, 교통부, 환경부와 세계은행 기술팀이 협력하여 시엠립, 바탐방, 깐달주의 타크마으마을, 캄퐁스프지역의 츠바몬 마을, 시아눅빌에서 시행할 것이라고 말함. ",사업 종료 후 5개 마을에는 적절한 위생 시설 및 매립지가 구축되어 환경 영향 감소 및 공공보건 향상에 도움이 될 것으로 기대됨.  더불어  일부 폐기물의 퇴비 전환 및 재활용 계획도 사업에 포함되어 있음,World Bank commits $60 million for five waste management sites,Several ministries and the World Bank have been studying plans for a project to improve solid and plastic waste management in the towns and districts of five provinces. The proposed improvements would cost approximately $60 million over six years and would be funded by the World Bank. ,"Nov Nith, head of the Office of Functions and Resources at the Ministry of Interior’s General Department of Administration, told The Post on February 22 that the project was being studied in order to collect input from all relevant departments with the study-phase scheduled for completion in March, 2022, prior to beginning its implementation. He said the project would be implemented by the ministries of Interior; Economy and Finance; Public Works and Transport; and Environment in collaboration with the World Bank Technical Team in the targeted locations of Siem Reap town, Battambang town, Kandal province’s Takhmao town, Kampong Speu province’s Chbar Mon town and Preah Sihanouk’s Sihanoukville.","After its implementation, it is expected that the five towns will have proper sanitation and landfills built to high technical standards that will reduce environmental impacts and improve public health. Part of the plans include the ability to recycle some of the rubbish into compost. ",Phnom Penh Post,https://phnompenhpost.com/national/world-bank-commits-60-million-five-waste-management-sites
493,모로코,2022-02-22,공여국,기후행동,"프랑스 투자 은행, 녹색 에너지 벤처 위해 모로코에 토대 마련",Bpifrance는 프랑스 환경 에너지 관리국(ADEME) 및 모로코 주재 프랑스 무역산업회의소와 협력하여 단기 확장 계획을 위한 토대를 마련함. 16개 기업에게 모로코의 비즈니스 환경을 이해하고 시장 조사 수행 지원 예정임.  ,이 프로그램은 아프리카에서의 토대을 강화 및 아프리카 대륙에서의 활동 다양화를 위한 은행 전략의 일부임. 은행은 북아프리카 국가의 야심찬 녹색 의제가 특히 탈탄소 산업 벤처 및 에너지 전환 같은 중요한 협력 기회를 제공한다고 주장함.,,French Investment Bank Flags Morocco for Green Energy Ventures,"In cooperation with the French Environment and Energy Management Agency (ADEME) and France’s Trade and Industry Chamber in Morocco, Bpifrance will support the 16 businesses to understand Morocco’s business climate and conduct market studies, paving the way for short-term expansion plans.","The program is part of the bank’s strategy to strengthen its foothold in Africa and diversify activities on the continent. The bank argued that the North African country’s ambitious green agenda offers significant opportunities for French actors to collaborate with Morocco, especially decarbonizing industry ventures and energy transition.",,Morocco World News,https://www.moroccoworldnews.com/2022/02/347238/french-investment-bank-flags-morocco-for-green-energy-ventures
494,우즈베키스탄,2022-02-22,국제기구,기후행동,우즈베키스탄에 GGGI 사무소 개소,우즈베키스탄에 글로벌녹색성장연구소 대표 사무실이 문을 열었다. 연구소는 이미 국가생태위원회와 함께 총사업비 565만 달러를 들여 아랄해 지역의 녹색복원 재원 마련 사업을 시작했다.,"해당 기관은 기후변화 측면에서 발전하고, 시장경제를 채택해 온 지역의 녹색경제 도모을 통한 지속가능한 경제 개발을을 목적으로 하고 있으며, 현재, 전 세계 30개국 이상에서 54개의 프로젝트를 시행하고 있다. 행사는 기구의 이사장인 반기문 전 유엔 사무총장의 영상 메시지로 시작되었다.",이 프로젝트는 한국국제협력단(KOICA)의 자금 지원을 받는다. 이 사업은 카라칼팍스탄의 녹색재건을 촉진해 아랄해 침체의 결과를 극복하는 것은 물론 지속가능한 생계 보장과 자연재해 복구 대책 마련이 목적이다. 행사 기간 중 글로벌녹색성장연구소와 지속가능발전위원회가 아랄해 유역 관련 녹색성장 및 기후변화 분야 협력 양해각서를 체결했다.,Global Green Growth Institute office opens in Uzbekistan,"A representative office of the Global Green Growth Institute was opened in Uzbekistan. Together with the State Committee for Ecology, the Institute has already launched a project to finance the green restoration of the Aral Sea region with a total cost of $ 5.65 million.","The purpose of the organization is to promote sustainable economic growth through the development of green economies in countries that are developing in the face of climate change and have chosen a market economy. Currently, the Institute implements 54 projects in more than 30 countries of the world. The President of the Assembly and Chairman of the Board of the Institute is former UN Secretary-General Ban Ki-moon. The event began with his video message.","The project is funded by the Korea International Cooperation Agency (KOICA). The aim of the project is to promote the green rehabilitation of Karakalpakstan to overcome the consequences of the recession of the Aral Sea, as well as to identify measures to ensure sustainable livelihoods and resilience to natural disasters. During the event, the Global Green Growth Institute and the Interstate Commission on Sustainable Development signed a memorandum of understanding on cooperation in the field of green growth and climate change relevant to the Aral Sea basin.",Gazeta.uz,https://www.gazeta.uz/ru/2022/02/22/gggi/
495,캄보디아,2022-02-22,공여국,물,Choeung Ek 하수처리장의 공사가 오늘 시작됨,Choeung Ek 하수처리장 공사가 2월 22일부터 시작되며 착공식에는  훈센 캄보디아 총리와 미카미 마사히로 캄보디아 주재 일본대사가 참석함. ,"프놈펜 공공사업 및 교통부에 따르면, 이 하수처리장은 하루에 약 5,000 입방미터의 폐수를 처리할 수 있고, 시간당 468입방미터의 폐수 양수 시설, 쓰레기 처리 시스템 및 10x1,690m의 배수용 시설로 구성되어 있다고 밝힘.",,Construction of Choeung Ek Sewage Treatment Plant Begins Today,"The construction of Choeung Ek sewage treatment plant starts today.The ground-breaking ceremony took place under the auspices of Cambodian Prime Minister Samdech Akka Moha Sena Padei Techo Hun Sen and H.E. Mikami Masahiro, Japanese Ambassador to Cambodia.","According to Phnom Penh Public Works and Transport Department, the treatment plant is capable to handle about 5,000 cubic metres of wastewater a day.The plant comprises a pumping facility of 468 cubic metres of wastewater per hour, sludge treatment system, and 10-by-1,690-metre road for drainage.",,AKP,http://www.akp.gov.kh/post/detail/248735
496,볼리비아,2022-02-22,수원국,교육,라파스 소재 학교 중 60%에 보수 필요,지난 21일부터 라파스 소재 일부 학교에서 대면 수업으로의 복귀가 진행됨. 그러나 까르멜로 로페스(Carmelo Lpez) 교육부 장관에 따르면 라파스 내 교육기관의 60%는 생물안정성에 대한 대책 등 대면 수업을 위한 환경이 충분히 갖춰지지 않음.,이들 교육기관은 지난 해부터 물이 나오지 않으며 화장실에 대한 정비도 이루어지지 않아 상태가 좋지 않음. 로페스 장관은 학교가 코로나19 발생 상황에서 학생들의 최소한의 생물학적 안전을 보장할 수 있는 필수 조건을 갖추어야 한다고 말함.,"나머지 교육기관에서도 블렌디드 러닝을 도입하기 시작함. 이는 학부모와 교사들의 합의 하에 내려진 결정으로, 이달 중 학생들의 원격수업 결석이 관찰되었기 때문임. 학생들의 결석은 디지털 장비에 대한 접근의 제한과 학생들의 원격수업에 대한 흥미 감소에 의한 것으로 분석됨.",,,,,paginasiete,https://www.paginasiete.bo/sociedad/2022/2/22/la-paz-el-60-de-colegios-no-estan-en-condiciones-324058.html
